User_ID,Cause_of_Death,Last_Post_Time,Comment_Time,Relative_Elapsed_Time,Commenter_Name,Comment,Tree_Hole,Wailing_Wall,Not_Related,Comments_Split
红烧土豆叶,学业压力/抑郁症/自杀,2020-10-13 02:00:00,2020-11-16 06:47:46,34.0,偷了今晚的月亮,昔书，真好啊！我真的考上教师编了。今天体检，希望一切顺利。我复试的时候，笔试第一，面试第一，比第二名综合成绩整整多了10分，我要去做我喜欢的事情了。前男友，我要放弃了，毕竟没有谁会一直在原地困住自己的，我也要向前走了，放过自己，放过自己。,Yes,Yes,No,"昔书,真好,我,真的,考上,教师编,今天,体检,希望,一切顺利,我,复试,时候,笔试,第一,面试,第一,比,第二名,综合,成绩,整整,多,10分,我,做,我,喜欢,事情,前男友,我,放弃,毕竟,没有,谁,一直,原地,困住,自己,我,向前走,放过,自己,放过,自己"
红烧土豆叶,学业压力/抑郁症/自杀,2020-10-13 02:00:00,2020-10-13 18:19:13,0.0,One_Apple_of_Roger,现在说什么都晚了，愿学弟你下辈子快乐吧…看到你头像是空轨的时候，感觉有点泪目，如果你还在的话我们肯定有不少共同语言吧,No,Yes,No,"现在,说什么,晚,愿,学弟,你,下辈子,快乐,…,看到,你,头像,空轨,时候,感觉,有点,泪目,如果,你,还在,我们,肯定,不少,共同语言"
红烧土豆叶,学业压力/抑郁症/自杀,2020-10-13 02:00:00,2020-10-14 00:10:49,0.0,玫玫当年退出文坛也是被逼无奈,感同身受，看得快要窒息了。快一天了，希望你已经降生在了一只小猫身上。而我会继续扛着压力活下去,No,Yes,No,"感同身受,得,快要,窒息,快,一天,希望,你,已经,降生,一只,小猫,身上,而,我,继续,扛着,压力,活下去,"
红烧土豆叶,学业压力/抑郁症/自杀,2020-10-13 02:00:00,2020-10-13 12:37:38,0.0,阿奇好运来,就是现在的我，赶实验进度➕找工作太感同身受了,Yes,No,No,"就是,现在,我,赶,实验,进度,➕,找,工作,感同身受,"
红烧土豆叶,学业压力/抑郁症/自杀,2020-10-13 02:00:00,2020-10-15 02:58:39,2.0,茉莉蜜Sir,愿此生功德，庄严佛净土。上报四重恩，下济三途苦。若有见闻者，悉发菩提心。尽此一报身，同登极乐国。十方三世一切佛，一切菩萨摩诃萨，摩诃般若波罗蜜。回向给红烧土豆叶同学，早登极乐,No,Yes,No,"愿,此生,功德,庄严,佛,净土,上报,四重,恩,下济,三途,苦,若,见闻,者,悉,发菩提心,尽,此,一,报身,同,登,极乐,国,十方,三世,一切,佛,一切,菩萨摩诃萨,摩诃般若波罗蜜,回向,红烧,土豆叶,同学,早,登,极乐,"
红烧土豆叶,学业压力/抑郁症/自杀,2020-10-13 02:00:00,2021-04-25 20:28:14,194.0,荷兰的豆阿逗,我有小猫咪了，可爱吧,No,Yes,No,"我,小,猫咪,可爱,"
红烧土豆叶,学业压力/抑郁症/自杀,2020-10-13 02:00:00,2020-10-13 15:13:18,0.0,软软姑娘_,既然走不下去，那就停在这里吧。 所有认识你的人，都说你是个非常好的男孩子啊。 下辈子做只猫咪，活的开心就好啦。🕯️,No,Yes,No,"既然,走,下去,停,在这里,所有,认识,你,人,说,你,非常,好,男,孩子,下辈子,做,只,猫咪,活,开心,就好,🕯️"
红烧土豆叶,学业压力/抑郁症/自杀,2020-10-13 02:00:00,2021-01-25 17:50:35,104.0,天真-往后余生,在天堂接一下一名叫陈淞阳的小伙子，他23岁 b站网名叫墨茶，你们都是善良的人，年龄也相仿肯定会有共同话题，还有，如果可以，带他在天堂吃些草莓，谢谢。,No,Yes,No,",天堂,接,一下,一名,叫,陈淞阳,小伙子,他,23岁,b站,网名,叫,墨茶,你们,都是,善良,的人,年龄,相仿,肯定,共同话题,还有,如果,可以,带,他,天堂,吃,些,草莓,谢谢,"
红烧土豆叶,学业压力/抑郁症/自杀,2020-10-13 02:00:00,2020-11-27 18:30:16,45.0,琼梦吖,昔书啊，哈工大的小哥哥，也不知道叫什么，你要是碰见了就照顾照顾他吧和他要在天堂开心啊,No,Yes,No,"昔书,哈工大,小哥哥,不知道,叫什么,你,要是,碰见,照顾,照顾,他,他,天堂,开心"
红烧土豆叶,学业压力/抑郁症/自杀,2020-10-13 02:00:00,2020-11-20 18:58:51,38.0,宋在元,收藏了这条微博，一方面是想用这条微博来永远记得原po；另一方面也是想告诉自己和大家每当对生活感到痛苦、绝望、快撑不下去的时候就来看看评论，我们都是人生这条路上的苦行僧，愿你我他每一位大家未来的每一天都能平安、快乐！,Yes,No,No,"收藏,这条,微博,一方面,想,用,这条,微博,永远,记得,原,po,另一方面,也是,想,告诉,自己,大家,每当,对,生活,感到,痛苦,绝望,快,撑不下去,时候,看看,评论,我们,都是,人生,这条,路上,苦行僧,愿,你我他,每一位,大家,未来,每一天,平安,快乐,"
红烧土豆叶,学业压力/抑郁症/自杀,2020-10-13 02:00:00,2020-11-19 12:14:54,37.0,PeachesRose,昔书 我们这边下雪了 2020年的第一场雪景哦 给你康康 很美 倘若你在场,No,Yes,No,"昔书,我们,这边,下雪,2020年,第一场,雪景,你,康康,很美,倘若,你,在场,"
红烧土豆叶,学业压力/抑郁症/自杀,2020-10-13 02:00:00,2020-10-18 14:53:34,5.0,宝灿啊,有时候一直在想 要是13号凌晨的我 可以刷到你的微博 联系110冲到化工楼 会不会你就不会离开这个世界了,No,Yes,No,"有时候,一直,想,要是,13号凌晨,我,可以,刷到,你,微博,联系,110,冲,化工,楼,会不会,你,不会,离开,这个,世界,"
红烧土豆叶,学业压力/抑郁症/自杀,2020-10-13 02:00:00,2020-10-14 12:31:45,1.0,葡萄味吸吸冻,你明明是一个就连放弃自己想着别人的好孩子呀。今天风像你一样温柔，如果你在风里，别忘了来抱抱我们,No,Yes,No,"你,明明,一个,连,放弃,自己,想着,别人,好,孩子,今天,风,像,你,一样,温柔,如果,你,风里,别忘,抱抱,我们,"
红烧土豆叶,学业压力/抑郁症/自杀,2020-10-13 02:00:00,2020-10-13 12:19:32,0.0,踏摇娘aaaaa,否定自己的心理过程我们一模一样😵这种事情真的很容易心态崩塌 我们都一样 你比我有勇气的多 如果能看到这条评论的话 把所有事情看轻都不在乎或许心里的压抑会少点,Yes,No,No,"否定,自己,心理,过程,我们,一模一样,😵,这种,事情,真的,很容易,心态崩塌,我们,都一样,你,比,我,勇气,多,如果,能看到,这条,评论,把,所有,事情,看轻,不在乎,或许,心里,压抑,少,点,"
红烧土豆叶,学业压力/抑郁症/自杀,2020-10-13 02:00:00,2021-05-06 17:51:05,205.0,yyyyyyulu,昔书，我考上研究生了,No,Yes,No,"昔书,我,考上,研究生,"
红烧土豆叶,学业压力/抑郁症/自杀,2020-10-13 02:00:00,2020-10-13 16:17:51,0.0,咕噜咕嚕冒泡,看到这条微博的时候已经来不及劝你了 如果这就是你的选择 走好吧 下辈子不做科研狗了 下辈子一定要遇上一个好老师 下辈子一定要快乐 下辈子要做一个大科学家呀 拜拜👋🏻,No,Yes,No,"看到,这条,微博,时候,已经,来不及,劝,你,如果,就是,你,选择,走好,下辈子,不做,科研,狗,下辈子,一定要,遇上,一个,好,老师,下辈子,一定要,快乐,下辈子,做,一个,大科学家,拜拜,👋,🏻,"
红烧土豆叶,学业压力/抑郁症/自杀,2020-10-13 02:00:00,2021-06-25 22:45:27,255.0,六G网络冲浪,昔书今天我资助的那个孩子的高考成绩出来了，考了650分，你说她厉不厉害厉不厉害。我只比她大六岁，可是她一直都叫我恩人偶像，今天她跟我视频说她要读到博士后像我一样，我真的快要哭出来了。我没想过她会这么有干劲，我想过了，我不用爸妈一分钱，只要她读书，不管读到什么学位我都供她。,Yes,No,No,"昔书,今天,我,资助,那个,孩子,高考,成绩,出来,考,650分,你,说,她,厉不厉害,厉不厉害,我,只,比,她,大,六岁,可是,她,一直,叫,我,恩人,偶像,今天,她,我,视频,说,她,读到,博士后,像,我,一样,我,真的,快要,哭出来,我,没想过,她,这么,干劲,我,想过,我,不用,爸妈,一分钱,只要,她,读书,不管,读到,什么,学位,我,供,她,"
红烧土豆叶,学业压力/抑郁症/自杀,2020-10-13 02:00:00,2020-10-27 17:35:22,14.0,KD和KT回归了吗,后天要结婚了，祝福我吧。在那边要照顾好自己哦，不知道你能不能找个伴侣呀，那样就不会孤独了。,Yes,Yes,No,"后天,结婚,祝福,我,在那边,照顾,好,自己,不知道,你,能不能,找,伴侣,那样,不会,孤独"
红烧土豆叶,学业压力/抑郁症/自杀,2020-10-13 02:00:00,2022-09-10 08:57:11,697.0,晚风略上脸颊,也希望昔书评论区的所有的友友们，都摆脱困境，笑容常驻，中秋快乐～,No,No,Yes,",希望,昔书,评论区,所有,友友们,摆脱,困境,笑容,常驻,中秋,快乐"
红烧土豆叶,学业压力/抑郁症/自杀,2020-10-13 02:00:00,2020-11-05 13:21:34,23.0,我家小晗晗LH7,哥，我觉得人生就是不断地从一个坑里跳到另一个坑里,No,Yes,No,"哥,我,觉得,人生,就是,不断地,一,坑,里,跳到,另一个,坑,里,"
红烧土豆叶,学业压力/抑郁症/自杀,2020-10-13 02:00:00,2021-03-10 13:27:00,148.0,_桃桃汁儿,看到这条评论的人 希望你开心,Yes,No,No,"看到,这条,评论,人,希望,你,开心"
红烧土豆叶,学业压力/抑郁症/自杀,2020-10-13 02:00:00,2020-12-08 02:31:13,56.0,Lcyself,我在武汉读了七年书啦，学物理化学和你一级，顺利的话明年毕业就离开这里了。上个月终于趁着免费去了趟黄鹤楼，给你看一眼武汉的老地标，景区里有只小花猫特别可爱，是你吗？,No,Yes,No,"我,武汉,读,七年,书,学,物理化学,你,一级,顺利,明年,毕业,离开,这里,上个月,终于,趁着,免费,趟,黄鹤楼,你,看一眼,武汉,老地标,景区,里,只,小花猫,特别可爱,你"
红烧土豆叶,学业压力/抑郁症/自杀,2020-10-13 02:00:00,2020-12-02 10:33:41,50.0,烦死我去,图片评论,No,No,Yes,图片评论
红烧土豆叶,学业压力/抑郁症/自杀,2020-10-13 02:00:00,2020-10-18 23:57:53,5.0,Qsewers,在我们这里，十九号就是你的头七了，我们这里的一种说法就是，逝去的人离开了七天，在第七天他会回到阳间看最后一眼，我想，你一定会回来看我们。会看到大家在你微博下面的评论，对你的离开表示惋惜，会看到大工好多人给你送花，在心底里默默地祝福着你，可能等你看到的时候，你已经有了超能力，,No,Yes,No,",我们,这里,十九号,就是,你,头,七,我们,这里,一种,说法,就是,逝去,人,离开,七天,第七天,他,回到,阳间,最后,一眼,我,想,你,一定,回来,我们,看到,大家,你,微博,下面,评论,对,你,离开,表示,惋惜,看到,大工,好多人,你,送花,心底里,默默地,祝福,你,可能,等,你,看到,时候,你,已经,有了,超能力"
红烧土豆叶,学业压力/抑郁症/自杀,2020-10-13 02:00:00,2021-01-02 12:09:45,81.0,七日夢遊綜合症_,宝贝有个小姑娘去找你了，记得照顾好她,No,Yes,No,"宝贝,小,姑娘,去找,你,记得,照顾,好,她,"
红烧土豆叶,学业压力/抑郁症/自杀,2020-10-13 02:00:00,2021-06-25 06:28:46,255.0,20146104_,考上已经有四天了，我还没从高兴里缓过来，去年考进了预科，现在我以全球排名第三的成绩通过入系考试 考上圣彼得堡国立音乐学院钢琴系了！,Yes,No,No,"考上,已经,四天,我,还没,高兴,里,缓过来,去年,考,进,预科,现在,我,以,全球,排名第三,成绩,通过,入,系,考试,考上,圣彼得堡国立音乐学院,钢琴系"
红烧土豆叶,学业压力/抑郁症/自杀,2020-10-13 02:00:00,2020-10-15 07:29:35,2.0,厂子的小迷弟啊,你也曾是银河的浪漫子民，孤身坠入地球，等不到群星来信。,No,Yes,No,"你,也曾,银河,浪漫,子民,孤身,坠入,地球,等不到,群星,来信,"
红烧土豆叶,学业压力/抑郁症/自杀,2020-10-13 02:00:00,2020-10-13 11:38:11,0.0,我是冉默,不要给自己那么大压力，时间空间看大一点，他们不过都是屁,No,Yes,No,"不要,自己,那么,大,压力,时间,空间,大,一点,他们,不过,都是,屁"
红烧土豆叶,学业压力/抑郁症/自杀,2020-10-13 02:00:00,2020-10-14 14:56:30,1.0,蜜思啦啦lala,为什么啊？能不能再坚持一下，就一下下，求求你了这么温暖幽默可爱的孩子！我是大专生我都很骄傲的，本科生更了不起了啊，咱不要研究生了，研究生名字都不好听。🙏🙏,No,Yes,No,"为什么,能不能,再,坚持,一下,一下下,求求,你,这么,温暖,幽默,可爱,孩子,我,大专生,我,骄傲,本科生,更,了不起,咱,不要,研究生,研究生,名字,不好听,🙏,🙏,"
红烧土豆叶,学业压力/抑郁症/自杀,2020-10-13 02:00:00,2020-10-14 14:14:04,1.0,今天无聊了吗__,你明明是一个可爱温柔的男孩子啊，可以再等等的，万一之后就有一只猫猫来救你了呢，它喜欢粘着你，溜进你宿舍找你玩，你难过的时候咕噜咕噜的安慰你。没关系啦 你肯定也尽力啦，是真的坚持不住了才会选择去做小猫咪，今天肯定会在世界上多一只温柔的猫咪。你的家人朋友会顺顺利利 我们的国家会繁荣昌盛,No,Yes,No,"你,明明,一个,可爱,温柔,男,孩子,可以,再,等等,万一,之后,一只,猫猫,救,你,它,喜欢,粘着,你,溜进,你,宿舍,找,你,玩,你,难过,时候,咕噜咕噜,安慰,你,没关系,你,肯定,尽力,真的,坚持,不住,才会,选择,做,小,猫咪,今天,肯定,世界,上,多,一只,温柔,猫咪,你,家人,朋友,顺顺利利,我们,国家,繁荣昌盛,"
红烧土豆叶,学业压力/抑郁症/自杀,2020-10-13 02:00:00,2020-10-14 14:05:33,1.0,撒哈拉冲浪手,昨晚在实验室发呆的我感同身受，研二了还没有论文和创新思路，不同的是我还在咬牙死撑，因为家里还有母亲需要我。朋友，一路走好🕯️ 🕯️ 🕯️,No,Yes,No,"昨晚,实验室,发呆,我,感同身受,研二,还没有,论文,创新思路,不同,我,还在,咬牙,死撑,因为,家里,还有,母亲,需要,我,朋友,一路走好,🕯️,🕯️,🕯️,"
红烧土豆叶,学业压力/抑郁症/自杀,2020-10-13 02:00:00,2022-01-19 01:55:09,462.0,请让我掀了那张桌子,独自异国求学，遇上科研不顺，和异国恋的女友又闹矛盾，很是抑郁，好在晚霞很不错，想着也没人可以分享，就顺便送给你吧。,Yes,No,No,"独自,异国,求学,遇上,科研,不顺,异国恋,女友,闹矛盾,抑郁,好在,晚霞,很不错,想着,没人,可以,分享,顺便,送给,你"
红烧土豆叶,学业压力/抑郁症/自杀,2020-10-13 02:00:00,2020-10-14 20:36:14,1.0,卿言_,祝愿祖国繁荣昌盛，祝愿看到的好人都心想事成，祝愿每一个温柔的黄昏啊，每一个善良的人都能感受到温柔的风 祝愿众生一切，也祝愿你这一生积累的福报，在下一世可以过幸福的生命，如果你可以看到感受到，我们的灵魂终将相遇呢，抱抱善良的灵魂，解脱了俗世的劳累和苦痛，念了点经回向给你给众生，祝好,No,Yes,No,"祝愿,祖国,繁荣昌盛,祝愿,看到,好人,心想事成,祝愿,每一个,温柔,黄昏,每一个,善良,的人,感受到,温柔,风,祝愿,众生,一切,祝愿,你,这一生,积累,福报,下一世,可以,过,幸福,生命,如果,你,可以,看到,感受到,我们,灵魂,终将,相遇,抱抱,善良,灵魂,解脱,俗世,劳累,苦痛,念,点,经,回向,你,众生,祝好,"
红烧土豆叶,学业压力/抑郁症/自杀,2020-10-13 02:00:00,2020-10-14 10:40:39,1.0,Acteur-,现在你可以走慢一点了，不会太辛苦。,No,Yes,No,"现在,你,可以,走,慢,一点,不会,辛苦"
红烧土豆叶,学业压力/抑郁症/自杀,2020-10-13 02:00:00,2020-10-21 20:55:18,8.0,Gyl今天还活着嘛,你不要去做猫，我们国家没有完善的法律，昨天一只怀孕的母猫被人用开水浇，四个孩子都死了，今天它也死了，如果你成为了一只小野猫，谁来保护你,No,Yes,No,"你,不要去,做,猫,我们,国家,没有,完善,法律,昨天,一只,怀孕,母猫,被,人,用,开水,浇,四个,孩子,死了,今天,它,死了,如果,你,成为,一只,小,野猫,谁,保护,你,"
红烧土豆叶,学业压力/抑郁症/自杀,2020-10-13 02:00:00,2020-10-19 00:31:31,5.0,Qsewers,我刚刚搜了一下，昔书学长。我跟你说，当你走过奈何桥的时候，你一定顺顺利利的过桥，因为你是善人，会有人保佑善人顺利过桥，你记得一定要喝孟婆婆给你的汤，这样你才能变成一只猫咪，在望乡台再看看我们这些朋友，再看看自己的亲人还有朋友，看看三生石自己的下辈子，如果允许的话，我希望你下辈子,No,Yes,No,"我,刚刚,搜,一下,昔书,学长,我,你,说,当,你,走过,奈何桥,时候,你,一定,顺顺利利,过桥,因为,你,善人,有人,保佑,善人,顺利,过桥,你,记得,一定要,喝,孟婆婆,你,汤,这样,你,才能,变成,一只,猫咪,望,乡,台,再,看看,我们,这些,朋友,再,看看,自己,亲人,还有,朋友,看看,三生石,自己,下辈子,如果,允许,我,希望,你,下辈子"
红烧土豆叶,学业压力/抑郁症/自杀,2020-10-13 02:00:00,2020-10-13 14:53:03,0.0,不会后空翻,前段时间也有过不好的念头，现在看开了，就像导师批的，研究生也不是非读不可的，真到了最坏的时候宁愿退学也不要放弃生命。这位同学如果你还能看到的话，请一定要珍惜你自己，现在很多诸如买房结婚子女教育这些外界强加的压力，这些都可以抛弃掉，他们连你生命的万分之一都不到，一定要珍惜你自己！,Yes,No,No,"前段时间,也有,过,不好,念头,现在,看开,就像,导师,批,研究生,也不是,非读不可,真,最坏,时候,宁愿,退学,不要,放弃,生命,这位,同学,如果,你,还能,看到,请,一定要,珍惜,你自己,现在,很多,诸如,买房,结婚,子女,教育,这些,外界,强加,压力,这些,可以,抛弃,掉,他们,连,你,生命,万分之一,不到,一定要,珍惜,你自己,"
红烧土豆叶,学业压力/抑郁症/自杀,2020-10-13 02:00:00,2022-06-11 01:14:26,605.0,去码头整点薯条怎么样,在学长这里偷偷发个誓，我虽然不学刑法学商法，但我要很努力很努力，我要夺回本就属于女孩子的权利。,Yes,No,No,",学长,这里,偷偷,发,誓,我,虽然,学,刑法学,商法,我,努力,努力,我,夺回,本,属于,女,孩子,权利"
红烧土豆叶,学业压力/抑郁症/自杀,2020-10-13 02:00:00,2020-10-13 12:37:37,0.0,梦太杂多,同学，众筹开个猫咖怎么样？猫猫那么可爱，别走了,No,Yes,No,"同学,众筹,开,猫,咖,怎么样,猫猫,那么,可爱,别走,"
红烧土豆叶,学业压力/抑郁症/自杀,2020-10-13 02:00:00,2021-03-05 01:53:18,142.0,狼来了的信徒,今天在微博上看到了一个小姐姐也是留了遗书然后走掉了，看到后立刻就想到了你。我记得第一次看到你这条微博的时候，我坐在教室眼泪止不住的掉。人生百态，希望你们开心，我们也是。,No,Yes,No,"今天,微博,上,看到,一个,小姐姐,也是,留,遗书,然后,走掉,看到,后,立刻,想到,你,我,记得,第一次,看到,你,这条,微博,时候,我,坐,教室,眼泪,止不住,掉,人生,百态,希望,你们,开心,我们,也是"
红烧土豆叶,学业压力/抑郁症/自杀,2020-10-13 02:00:00,2020-10-18 00:08:24,4.0,Qsewers,明天就是十九号了，在我们这里有一种说法，离开的人在去世后七天会重新回到阳间看最后一眼，我想你一定话打开微博，发现我们大家对你说的话，看到大工很多人为你献的花，看到大工周围那么多的猫咪被好好照顾，最后再做一次实验，相信你一定会得到你想要的数据，对吗？,No,Yes,No,"明天,就是,十九号,我们,这里,一种,说法,离开,人,去世后,七天,重新,回到,阳间,最后,一眼,我,想你,一定,打开,微博,发现,我们大家,对,你,说,看到,大工,很多人,为,你,献,花,看到,大工,周围,那么多,猫咪,被,好好,照顾,最后,再,做,一次,实验,相信,你,一定,得到,你,想要,数据,对吗,"
红烧土豆叶,学业压力/抑郁症/自杀,2020-10-13 02:00:00,2020-10-13 18:02:18,0.0,子见南子-,上午听说这一消息，晚上读完你写的告别信，吐槽完该吐槽的，就只有长久的沉默了。愿学长来世无忧无虑，猫生快乐。,No,Yes,No,"上午,听说,一,消息,晚上,读完,你,写,告别,信,吐槽,完,该,吐槽,只有,长久,沉默,愿,学长,来世,无忧无虑,猫,生,快乐"
红烧土豆叶,学业压力/抑郁症/自杀,2020-10-13 02:00:00,2020-10-13 10:27:13,0.0,颍源居,陌生的朋友，愿一切都好。,No,Yes,No,"陌生,朋友,愿,一切都好,"
红烧土豆叶,学业压力/抑郁症/自杀,2020-10-13 02:00:00,2021-01-02 02:12:54,81.0,星落心起,好像有个小师妹来找你啦，你要接住她哦,No,Yes,No,"好像,小师妹,找,你,你,接住,她,"
红烧土豆叶,学业压力/抑郁症/自杀,2020-10-13 02:00:00,2020-10-15 11:54:57,2.0,江海熠生,7月初南京航空航天大学大四女生因毕业论文一事，独自离开校园去西西可里无人区身亡。9月19日南京大学博士生第四年学生从18楼跳下坠亡。10月12日，大连理工大学一研究生死在实验室。高校的精英、祖国的花朵如此频繁地轻生 ，应该成为专家、学者重点研究的社会现象 应该引起整个社会的反思,Yes,No,No,"7月初,南京航空航天,大学,大四,女生,因,毕业,论文,一事,独自,离开,校园,西西可里无人区,身亡,9月19日,南京,大学,博士生,第四年,学生,18,楼,跳下,坠亡,10月12日,大连理工,大学,一,研究生,死,实验室,高校,精英,祖国,花朵,如此,频繁,地,轻生,应该,成为,专家,学者,重点,研究,社会现象,应该,引起,整个,社会,反思"
红烧土豆叶,学业压力/抑郁症/自杀,2020-10-13 02:00:00,2021-10-08 15:45:56,360.0,所遇皆为上上签,在树上发现的,Yes,No,No,",树上,发现"
红烧土豆叶,学业压力/抑郁症/自杀,2020-10-13 02:00:00,2020-11-06 08:30:11,24.0,寒冷不爱工作,早安，土豆叶，我现在在一号线的地铁上，你也经常坐一号线吧，人总是很多。公司有个男生也坐一号线，总是在下车的时候遇到他，我希望他不要总是把位子让给其他人，河口到东纬路也挺远的，我希望他不要总是一个人去吃饭，有个高个子男生看着人也不错，会是个好玩伴。最后的私心，希望今天也能遇到他。,No,Yes,No,"早安,土豆叶,我,现在,一号线,地铁,上,你,经常,坐,一号线,人,总是,很多,公司,男生,坐,一号线,总是,下车,时候,遇到,他,我,希望,他,不要,总是,把,位子,让给,其他人,河口,东纬路,挺远,我,希望,他,不要,总是,一个人,吃饭,高个子,男生,看着,人,不错好,玩伴,最后,私心,希望,今天,遇到,他"
红烧土豆叶,学业压力/抑郁症/自杀,2020-10-13 02:00:00,2020-10-14 11:52:07,1.0,衬我欢颜丨,我来养只猫吧，别做野猫了，大工野猫太多你会受欺负的！,No,Yes,No,"我,养,只,猫,别,做,野猫,大工,野猫,太多,你,受欺负"
红烧土豆叶,学业压力/抑郁症/自杀,2020-10-13 02:00:00,2020-10-15 11:43:29,2.0,长影烟花-,评论区某些\憨批不会说会话就请你闭嘴好嘛。站在制高点对他指指点点的你算个什么东西。为你自己积点口德吧,No,No,Yes,"评论区,某些,\,憨,批,不会,说,会话,请,你,闭嘴,好,站,制高点,对,他,指指点点,你,算,什么东西,为,你自己,积,点,口德,"
红烧土豆叶,学业压力/抑郁症/自杀,2020-10-13 02:00:00,2020-11-17 19:20:02,35.0,King在打工,关注这么久了，也来评论一下吧，和你也是校友，每次路过这里，这只猫咪都好粘人。人生不论什么选择，都要开开心心,No,Yes,No,"关注,这么,久评论,一下,你,也是,校友,每次,路过,这里,这只,猫咪,好,粘人,人生,不论什么,选择,开,开心,心"
红烧土豆叶,学业压力/抑郁症/自杀,2020-10-13 02:00:00,2020-10-14 10:12:16,1.0,哈密瓜芒果香蕉,同学 其实 延毕没有什么大不了 数据错误也没有什么大不了 我们以往的教育总说要我们做对做好做大事 在规定内完成所有事情 那没有做到的那部分人呢？ 没有人告诉他们该怎么办 如果我能认识你就好了 我会告诉你,No,Yes,No,"同学,其实,延毕,没有什么,大不了,数据,错误,没有什么,大不了,我们,以往,教育,总,说,我们,做对,做好,做大事,规定,内,完成,所有,事情,没有,做到,部分,人,没有人,告诉,他们,该怎么办,如果,我,认识,你,就好,我,告诉,你"
红烧土豆叶,学业压力/抑郁症/自杀,2020-10-13 02:00:00,2020-10-13 13:19:35,0.0,-我们的故事23,看完让我立马回忆起了前几年的生活…ptsd了。自我接受程度太低非常容易被自己困住根本走不出来。亲测心理咨询有点用，因为在无法调节的时候是需要出口的，非常必要。,Yes,No,No,"看完,我,立马,回忆起,前几年,生活,…,ptsd,自我,接受程度,太低,非常,容易,被,自己,困住,根本,走,出来,亲测,心理咨询,有点用,因为,无法,调节,时候,需要,出口,非常,必要"
红烧土豆叶,学业压力/抑郁症/自杀,2020-10-13 02:00:00,2020-10-13 11:56:49,0.0,全世界最喜欢摸鱼的人,用你的命换来什么都不值得。学校要怎么通知家长呢？老师和设备付得起责任吗？家长要如何面对这位同学的不辞而别？希望家长能平安。,No,Yes,No,"用,你,命,换来,什么,不值得,学校,怎么,通知,家长,老师,设备,付得起,责任,家长,如何,面对,这位,同学,不辞而别,希望,家长,平安"
