User_ID,Cause_of_Death,Last_Post_Time,Comment_Time,Relative_Elapsed_Time,Commenter_Name,Comment,Tree_Hole,Wailing_Wall,Not_Related,Comments_Split
刘学州a,儿童收养/网暴/抑郁症/自杀,2022-01-24 00:02:00,2022-03-05 12:42:44,40.0,勿忘心安23332019G,一个多月了，还是一次又一次的翻看你的万字长言，字字泣血，知道你再也看不到，可还是想说，小宝贝你的离去让很多心地善良人伤心难过，让很多有爱心的人意难平，希望相关部门能早日严惩伤害过你的人，给你短暂的15年画上一个句号，也希望你冥冥之中能感应到。,No,Yes,No,"一个多月,还是,一次又一次,翻看,你,万字,长言,字字,泣血,知道,你,再也,看不到,还是,想说,小,宝贝,你,离去,很多,心地,善良,人,伤心,难过,很多,爱心,人意难平,希望,相关,部门,早日,严惩,伤害,过,你,人,你,短暂,15年,画,上一个,句号,希望,你,冥冥之中,感应,"
刘学州a,儿童收养/网暴/抑郁症/自杀,2022-01-24 00:02:00,2022-03-03 07:50:36,38.0,世界很美好202108,刘学州同学，开学了，作为学生会主席、优秀学生干部，你是老师的得力助手，是同学们的好伙伴，你去哪里了?请立即返校，上课你悄无声息的离开，有写请假条吗？老师批准同意了吗？回来，宿舍开门了可以住宿了,No,Yes,No,"刘学州,同学,开学,作为,学生会主席,优秀学生,干部,你,老师,得力助手,同学们,好伙伴,你,去哪里,?,请,立即,返校,上课,你,悄无声息,离开,写,请假条,老师,批准,同意,回来,宿舍,开门,可以,住宿,"
刘学州a,儿童收养/网暴/抑郁症/自杀,2022-01-24 00:02:00,2022-02-20 00:28:07,27.0,蒜香要快le,最近出现反转了，“守护心灵”放出了聊天记录，你的舅妈怀疑你是被迫自杀已经报案了，放心吧，如果这是真的，那一定还你真相，在那边照顾好自己，晚安刘学州同学，大家很想你,No,Yes,No,"最近,出现,反转,“,守护,心灵,”,放出,聊天记录,你,舅妈,怀疑,你,被迫,自杀,已经,报案,放心,如果,真的,一定,你,真相,在那边,照顾,好,自己,晚安,刘学州,同学,大家,想你"
刘学州a,儿童收养/网暴/抑郁症/自杀,2022-01-24 00:02:00,2022-01-28 03:14:08,4.0,那就让我的喜怒哀乐自生自灭,我又失眠了 整宿整宿睡不着 我没你那么勇敢 可能是我没有像你一样想死的决心 我很爱这个世界又很讨厌这个世界 也有我放心不下的人 我还有两只张着嘴的猫 可是有时候真的好累 也想跟你一样 眼睛一闭一睁就重生 可还是不行我得好好活着我的理想没实现我的抱负还没完成我爱的人还没娶我我还想跟他生个孩子,Yes,Yes,No,"我,失眠,整宿,整宿,睡不着,我,你,那么,勇敢,可能,我,没有,像,你,一样,想死,决心,我,很爱,这个,世界,讨厌,这个,世界,也有,我,放心不下,人,我,还有,两只,张着嘴,猫,可是,有时候,真的,好累,也想,你,一样,眼睛,一,闭,一,睁,重生,还是,不行,我,得,好好,活着,我,理想,实现,我,抱负,还没,完成,我,爱,人,还没,娶,我,我,想,他,生,孩子"
刘学州a,儿童收养/网暴/抑郁症/自杀,2022-01-24 00:02:00,2022-03-09 00:04:12,44.0,别惹我很护剧,弟弟今天我就满16岁啦，离去三亚看你又近了一步没想到吧我们是同龄人哈哈，希望你在那边过得好毕竟我双手合十的愿望都是你呀@刘学州a,Yes,Yes,No,"弟弟,今天,我,满,16岁,离去,三亚,你,近,一步,没想到,我们,同龄人,哈哈,希望,你,在那边,过得好,毕竟,我,双手合十,愿望,都是,你,@刘学州a"
刘学州a,儿童收养/网暴/抑郁症/自杀,2022-01-24 00:02:00,2022-03-01 01:10:40,36.0,护学之州,州，今天有好消息传来，三亚公安已经确认全力彻查你的事情了。等着吧，那些坏人一定会受到惩罚的。你放心在天上玩儿哈！正义来到那天不会太久了。,No,Yes,No,"州,今天,好消息,传来,三亚,公安,已经,确认,全力,彻查,你,事情,等着,那些,坏人,一定,受到,惩罚,你,放心,天上,玩儿,正义,来到,那天,不会,太久"
刘学州a,儿童收养/网暴/抑郁症/自杀,2022-01-24 00:02:00,2022-02-18 12:38:52,25.0,别惹我很护剧,大家可以去关注一下“守护心灵大洋哥”，这是弟弟生前认识的一个三亚哥哥我们需要转移阵地发声啦,Yes,No,No,"大家,可以,关注,一下,“,守护,心灵,大洋,哥,”,弟弟,生前,认识,一个,三亚,哥哥,我们,需要,转移,阵地,发声"
刘学州a,儿童收养/网暴/抑郁症/自杀,2022-01-24 00:02:00,2022-01-30 16:27:10,6.0,晴晴和倍倍,我们的民政部门是摆设吗？猥亵他的老师那么难查吗？这样的弱势群体我们国家是不是要出台关爱政策，多么优秀又自强的孩子，是祖国的未来与花朵，我们不希望再有第二个第三个刘学州，这是来自我们百姓的心声，不要让我们寒心却步，望重视！！,Yes,Yes,No,"我们,民政,部门,摆设,猥亵,他,老师,那么,难,查,这样的,弱势群体,我们,国家,是不是,出台,关爱,政策,多么,优秀,自强,孩子,祖国,未来,与,花朵,我们,希望,再有,第二个,第三个,刘学州,来自,我们,百姓,心声,不要让,我们,寒心,却步,望,重视,"
刘学州a,儿童收养/网暴/抑郁症/自杀,2022-01-24 00:02:00,2022-01-30 09:56:57,6.0,狐狸不爱系裤腰带,姐姐一定会为你讨回公道,No,Yes,No,"姐姐,一定,为,你,讨回,公道,"
刘学州a,儿童收养/网暴/抑郁症/自杀,2022-01-24 00:02:00,2022-01-29 16:56:36,5.0,贽o,州宝，哥又来看你了,No,Yes,No,"州宝,哥,来看你了,"
刘学州a,儿童收养/网暴/抑郁症/自杀,2022-01-24 00:02:00,2022-01-29 13:42:50,5.0,阳光天使小张,你知道吗？你在我生命中已经扮演着一个很重要的角色了，虽然我认识你已经太迟了，如果早点儿认识你，可能结果就不会这样无法挽回，这个事儿让我抱憾终生。,No,Yes,No,"你,知道吗,你,我,生命中,已经,扮演,一个,重要,角色,虽然,我,认识,你,已经,太迟,如果,早点,儿,认识,你,可能,结果,不会,这样,无法挽回,这个,事儿,我,抱憾终生"
刘学州a,儿童收养/网暴/抑郁症/自杀,2022-01-24 00:02:00,2022-01-29 09:23:31,5.0,如果爱p1,宝贝回家？可他认亲后没有家可回，这对恶毒的父母用无情杀死了他们的孩子，孩子太不值了,No,Yes,No,"宝贝,回家,他,认亲,后,没有,家,回,对,恶毒,父母,用,无情,杀死,他们,孩子,孩子,不值"
刘学州a,儿童收养/网暴/抑郁症/自杀,2022-01-24 00:02:00,2022-01-29 00:17:41,5.0,Meiieiun,我妈说看了你的一生 哭了几天 这回我爸没说她老喜欢哭了（其实我会想，如果有神就好了，这是不是神对你的一次考验呢，尽管经历了那么多的恶，但你还是保持了善良、追求光明！嗯～所以神要奖励你！下辈子、下下辈子...在充满爱的家庭里长大！人人爱你！)至于那两个晦气的人，转入畜牲道,No,Yes,No,"我妈,说,你,一生,哭,几天,这回,我爸,说,她,老,喜欢,哭,其实,我,想,如果,有神,就好,是不是,神,对,你,一次,考验,尽管,经历了,那么多,恶,你,还是,保持,善良,追求,光明,所以,神,奖励,你,下辈子,下,下辈子,.,.,.,充满,爱,家庭,里,长大,人人,爱,你,),至于,两个,晦气,人,转入,畜牲,道,"
刘学州a,儿童收养/网暴/抑郁症/自杀,2022-01-24 00:02:00,2022-01-27 16:48:58,3.0,田馨9451,好有才华好懂事又悲苦的孩子。只是想要个家而已，孩子心里应该是想要个心灵的家，有爸爸妈妈的关爱。这么简单的要求都得不到。心怀恶意的喷子欺负这个爹不疼娘不爱的孩子。众口铄金，终于逼走了你。傻孩子，你该好好活着气死那些对你不好的人，而不该拿别人的错误惩罚自己。国家又少了个栋梁之材。,No,Yes,No,"好,有才华,好,懂事,悲苦,孩子,只是,想要,家,而已,孩子,心里,应该是,想要,心灵,家,爸爸妈妈,关爱,这么,简单,要求,得不到,心怀恶意,喷子,欺负,这个,爹,不疼,娘,不爱,孩子,众口铄金,终于,逼走,你,傻,孩子,你,该,好好,活着,气死,那些,对,你,不好,人,而,不该,拿,别人,错误,惩罚,自己,国家,少,栋梁之材,"
刘学州a,儿童收养/网暴/抑郁症/自杀,2022-01-24 00:02:00,2022-01-26 01:28:04,2.0,善良如他,管管刘学州的事吧，大晚上来看又泪目，新京报怎么还在一直活跃呢，他爸妈还没忏悔嘛?，网暴过的人，怎么一个都没管,Yes,No,No,"管管,刘学州,事,大,晚上,来看,泪目,新京报,怎么,还在,一直,活跃,他,爸妈,还没,忏悔,?,网暴,过,人,怎么,一个,管"
刘学州a,儿童收养/网暴/抑郁症/自杀,2022-01-24 00:02:00,2022-01-24 11:16:52,0.0,小薄荷姐姐o,一大早给我整破防了，看完哭到现在，很难过很难过，雪崩的时候没有一片雪花是无辜的，亲人的绝情，朋友的冷漠，还有一个个的网络侩子手，如果那些坏人没有受到惩罚，那么今天就是互联网最黑暗的一天。,Yes,Yes,No,"一大早,我,整,破防,看完,哭,现在,难过,难过,雪崩,时候,没有,一片,雪花,无辜,亲人,绝情,朋友,冷漠,还有,一个,网络,侩子,手,如果,那些,坏人,没有,受到,惩罚,那么,今天,就是,互联网,最,黑暗,一天"
刘学州a,儿童收养/网暴/抑郁症/自杀,2022-01-24 00:02:00,2022-01-24 10:08:52,0.0,竺竺儿,别的孩子寻亲找到亲生父母是新生命的开始，而小学州却是生命的结束。让他生命戛然而止的是：他狠心的父母、变态初中老师、杀人于无形的无良媒体和网络喷子……这些刽子手必须严惩！世界那么大，怎么就容不下一个十五岁的孩子……但愿来生能被满满的爱包围,Yes,Yes,No,"别,孩子,寻亲,找到,亲生,父母,新生命,开始,而,小学州,却是,生命,结束,他,生命,戛然而止,他,狠心,父母,变态,初中,老师,杀人,于,无形,无良,媒体,网络喷子,…,…,这些,刽子手,必须,严惩,世界,那么,大,怎么,容,下一个,十五岁,孩子,…,…,但愿,来生,被,满满,爱,包围,"
刘学州a,儿童收养/网暴/抑郁症/自杀,2022-01-24 00:02:00,2022-03-03 10:16:26,38.0,想念州州,州州，因为你我关注了河北法商中等专业学校公众号，看到他们今天发的消息说开学了，春风和煦，春意盎然，春日正是读书时，可是却再也看不到你的身影,No,Yes,No,"州州,因为,你我,关注,河北法商中等专业学校,公众号,看到,他们,今天,发,消息,说,开学,春风,和煦,春意盎然,春日,正是,读书,时,可是,再也,看不到,你,身影"
刘学州a,儿童收养/网暴/抑郁症/自杀,2022-01-24 00:02:00,2022-02-28 00:46:01,35.0,李瀚瀛,州，昨晚哥哥已经把五七的钱从北京景泰路和桃杨路的十字路口给你烧过去了，相信一定已经收到了。你要开启自己的新生了，我也要收拾情绪好好生活了，不过，此生的你会在我记忆中永存的。 就到这里吧，那就好好告个别吧相信有一天我们一定会再相逢的??,No,Yes,No,"州,昨晚,哥哥,已经,把,五七,钱,北京,景泰路,桃,杨路,十字路口,你,烧,过去,相信,一定,已经,收到,你,开启,自己,新生,我,收拾,情绪,好好,生活,不过,此生,你,我,记忆中,永存,这里好好,告,个别,相信,有一天,我们,一定,再,相逢,?,?,"
刘学州a,儿童收养/网暴/抑郁症/自杀,2022-01-24 00:02:00,2022-02-08 00:40:52,15.0,神秘丶poet,好孩子，我不知道你看没看过哆啦A梦，在这部动画里，有一个机器是可以穿梭时空的，多想这种样子的机器可以出现在现实里，这样我一定要穿梭到今年的1月22号，买最快的航班赶往三亚，在1月23号的深夜赶到你最后去到的那个港湾，夺下你手里的药和酒瓶，告诉你：“这世界上还有那么多关心你的人”,No,Yes,No,"好,孩子,我,不知道,你,没看过,哆啦A梦,这部,动画,里,一个,机器,可以,穿梭,时空,多想,这种,样子,机器,可以,出现,现实里,这样,我,一定要,穿梭,今年,1月22号,买,最快,航班,赶往,三亚,1月23号,深夜,赶到,你,最后,那个,港湾,夺下,你,手里,药,酒瓶,告诉,你,“,世界,上,还有,那么多,关心,你,人,”,"
刘学州a,儿童收养/网暴/抑郁症/自杀,2022-01-24 00:02:00,2022-02-02 22:12:20,9.0,那就让我的喜怒哀乐自生自灭,大年初二了，我多希望你发条微博，告诉我们再占用下你们的时间，我穿复活甲复活了，我会好好生活，感谢遇见。,No,Yes,No,"大年初二,我,多,希望,你,发条,微博,告诉,我们,再,占用,下,你们,时间,我,穿,复活,甲,复活,我,好好,生活,感谢,遇见"
刘学州a,儿童收养/网暴/抑郁症/自杀,2022-01-24 00:02:00,2022-01-30 21:04:48,6.0,小付瑾,今天是你刚出生的第七天 你的爸爸妈妈 爷爷奶奶 姥姥姥爷 都好爱你呀 亲不够你 抱不够你的 希望你天天快乐呀 ～,No,Yes,No,"今天,你,刚,出生,第七天,你,爸爸妈妈,爷爷奶奶,姥姥姥爷,好,爱,你,亲,不够,你,抱,不够,你,希望,你,天天,快乐,"
刘学州a,儿童收养/网暴/抑郁症/自杀,2022-01-24 00:02:00,2022-01-30 20:38:59,6.0,秋凉不是冬,州州，按民俗，今天是你的头七，愿你忘掉所有的不开心，你是误入人间的天使，这个世界不配你的好！愿你往后无任何时何地都万事胜意、平安喜乐！,No,Yes,No,"州州,按,民俗,今天,你,头,七,愿,你,忘掉,所有,不开心,你,误入,人间,天使,这个,世界,不配,你,好,愿,你,往后,无,任何时,何地,万事胜意,平安喜乐"
刘学州a,儿童收养/网暴/抑郁症/自杀,2022-01-24 00:02:00,2022-01-30 12:50:42,6.0,与爱同行923,从你的遗书中可以看出，其实养家爷爷奶奶孩子很多，你的离去不会影响他们的生活。乖，你太善良了，说得好含蓄！记得你在直播间说过，其实养家不愿意补贴你的学费生活费，所以你必须得为生活劳累打工挣钱养活自己。可怜的孩子，太让人心疼了,No,Yes,No,",你,遗书,中,可以,看出,其实,养家,爷爷奶奶,孩子,很多,你,离去,不会,影响,他们,生活,乖,你,善良,说得好,含蓄,记得,你,直播间,说过,其实,养家,不愿意,补贴,你,学费,生活,费,所以,你,必须,得,为,生活,劳累,打工,挣钱,养活,自己,可怜,孩子,人,心疼,"
刘学州a,儿童收养/网暴/抑郁症/自杀,2022-01-24 00:02:00,2022-01-27 09:37:02,3.0,一定要改名的Emma,他描述得很客观，完全没有因恨跟他亲生父母一样泼脏水,Yes,No,No,"他,描述,得,客观,完全,没有,因,恨,他,亲生,父母,一样,泼脏水,"
刘学州a,儿童收养/网暴/抑郁症/自杀,2022-01-24 00:02:00,2022-01-26 10:48:47,2.0,亚lanlanlan,短短一个月你就变成有心事的大人了，乖乖你再坚持几天，你把你写的这些话发出来让大家了解之后你再决定要不要离开这个世界啊，为什么要先吃药，为什么不给我们拯救你的机会。你很快就长大了，很快的，那时候你更坚强，也会有更多人帮你，也不会再纠结于一些人的谩骂，你会思想成熟的，好遗憾啊学州,No,Yes,No,"短短,一个月,你,变成,有心事,大人,乖乖,你,再,坚持,几天,你,把,你,写,这些话,发出来,大家,了解,之后,你,再,决定,要不要,离开,这个,世界,为什么,先,吃药,为什么不,我们,拯救,你,机会,你,很快,长大,很快,那时候,你,更,坚强更多,人,帮,你,不会,再,纠结,于,一些人,谩骂,你,思想成熟,好,遗憾,学州"
刘学州a,儿童收养/网暴/抑郁症/自杀,2022-01-24 00:02:00,2022-01-25 13:34:36,1.0,卖名妆的大芒果,图片评论,No,No,Yes,图片评论
刘学州a,儿童收养/网暴/抑郁症/自杀,2022-01-24 00:02:00,2022-01-24 12:31:12,0.0,a耀眼的小水滴,热搜刚才还爆了 这会33了 降得真快啊,Yes,No,No,"热搜,刚才,爆,33,降,得,真快,"
刘学州a,儿童收养/网暴/抑郁症/自杀,2022-01-24 00:02:00,2022-01-24 00:12:40,0.0,sangsangEntro,喵喵喵，可见，希望是自己给自己的。不要寄希望于任何人，他们能给予的和你想要的总是偏一点。祝好，走了也要好。珍惜每个状态。,No,Yes,No,"喵喵喵,可见,希望,自己,自己,不要,寄,希望,于,任何人,他们,给予,你,想要,总是,偏,一点,祝,好,走,要好,珍惜,每个,状态,"
刘学州a,儿童收养/网暴/抑郁症/自杀,2022-01-24 00:02:00,2022-02-28 01:49:15,35.0,别惹我很护剧,五七给你带了一杯甜甜的奶茶，他们说昨天是你最后一天来人间看看了，我相信弟弟你一定喝到了我送给你的奶茶是吗,No,Yes,No,"五七,你,带,一杯,甜甜,奶茶,他们,说,昨天,你,最后一天,人间,看看,我,相信,弟弟,你,一定,喝,我,送给,你,奶茶,是吗"
刘学州a,儿童收养/网暴/抑郁症/自杀,2022-01-24 00:02:00,2022-02-06 19:01:41,13.0,树之林子,你说:生来即轻，还时亦净。我想说，你生的光荣，死的悲壮。生，荣誉加身，光环无数；死，战天斗地，感天动地。无数人落下了悲伤的眼泪，你的优秀、努力、善良、勇敢、坚强、帅气无不让我们扼腕叹息，一个天才的陨落。你说你要把自己活成一束光，你在黑暗中苦苦抗争了十五年，最终你的精神支柱轰然倒塌,No,Yes,No,"你,说,:,生来即轻,时,亦,净,我,想说,你,生,光荣,死,悲壮,生,荣誉,加身,光环,无数,死,战天斗地,感天动地,无数,人,落下,悲伤,眼泪,你,优秀,努力,善良,勇敢,坚强,帅气,无不,我们,扼腕叹息,一个,天才,陨落,你,说,你,把,自己,活成,一束,光,你,黑暗中,苦苦,抗争,十五年,最终,你,精神支柱,轰然,倒塌"
刘学州a,儿童收养/网暴/抑郁症/自杀,2022-01-24 00:02:00,2022-01-29 09:38:24,5.0,跳跳的小疯子,到现在还有人骂你。你走后都还不得安宁。现在才知道网暴的厉害，我们一些人对两个，他们都赢了。他们就是不要脸，他们骂的兴起，他们骂的高兴。你一个人对付他们那么多人一定很累吧。很抱歉以这种方式认识你。希望下世有个爱你的爸爸妈妈，有爱你的同学，希望你来世可以甜一点。,No,Yes,No,",现在,还有,人,骂,你,你,走后,不得安宁,现在,才知道,网暴,厉害,我们,一些人,对,两个,他们,赢了,他们,就是,不要脸,他们,骂,兴起,他们,骂,高兴,你,一个人,对付,他们,那么多,人,一定,很累,抱歉,以,这种,方式,认识,你,希望,下世,爱,你,爸爸妈妈,爱,你,同学,希望,你,来世,可以,甜,一点"
刘学州a,儿童收养/网暴/抑郁症/自杀,2022-01-24 00:02:00,2022-01-27 19:17:24,3.0,寂寞的季末14409,大家举报下这个人谢谢@长空看本质 这人还在诋毁，我不明白，一个15岁的孩子能想这么多？人家那么小当志愿者，为社会捐款，当志愿者，为社会做贡献，你15岁在干嘛呢？人家一没买热搜，二最开始没多说，为什么说人家炒作？人家夸大其词了？,Yes,No,No,"大家,举报,下,这个人,谢谢,@,长空,本质,这人,还在,诋毁,我,不明白,一个,15岁,孩子,想,这么多,人家,那么,小,当,志愿者,为,社会捐款,当,志愿者,为,社会,做贡献,你,15岁,干嘛,人家,一,买,热搜,二,最,开始,多说,为什么说,人家,炒作,人家,夸大其词"
刘学州a,儿童收养/网暴/抑郁症/自杀,2022-01-24 00:02:00,2022-01-24 02:18:34,0.0,闲逛游女,孩子你真傻，你就这样走掉，最得利的是你生父母。他们会在心里高兴说终于可以把你这个大麻烦给甩掉了，你要好好的活着不能让他们得逞。人生本来就很苦，每个人的一生都是坎坎坷坷的，没有任何人是一帆风顺。孩子坚强起来，关心你的人还有很多。,No,Yes,No,"孩子,你,真傻,你,就这样,走掉,最,得利,你,生,父母,他们,心里,高兴,说,终于,可以,把,你,这个,大麻烦,甩掉,你,好好的,活着,不能,他们,得逞,人生,本来,很苦,每个人,一生,都是,坎坎坷坷,没有,任何人,一帆风顺,孩子,坚强,起来,关心,你,人,还有,很多"
刘学州a,儿童收养/网暴/抑郁症/自杀,2022-01-24 00:02:00,2022-09-28 00:02:56,247.0,莺歌山之冬,#刘学州遗书希望加害者得到惩罚# 你说有机会还是想过9月28日的生日，今天陪你一起过，州州，生日快乐啊，小傻子！,No,Yes,No,"#,刘学州,遗书,希望,加害者,得到,惩罚,#,你,说,有机会,还是,想过,9月28日,生日,今天,陪,你,一起,过,州州,生日快乐,小,傻子,"
刘学州a,儿童收养/网暴/抑郁症/自杀,2022-01-24 00:02:00,2022-02-27 01:23:01,34.0,别惹我很护剧,弟弟你的照片我给打印出来了很好看呀,No,Yes,No,"弟弟,你,照片,我,打印,出来,好看"
刘学州a,儿童收养/网暴/抑郁症/自杀,2022-01-24 00:02:00,2022-02-23 08:11:34,30.0,贽o,早上好，又是阳光明媚的一天，愿你带着最温暖的阳光每天都过的美满温馨,No,Yes,No,"早上好,阳光明媚,一天,愿,你,带着,最,温暖,阳光,每天,过,美满,温馨,"
刘学州a,儿童收养/网暴/抑郁症/自杀,2022-01-24 00:02:00,2022-02-18 14:02:49,25.0,别惹我很护剧,弟弟你终于上热搜了一定会有人看到的一定会还你一个公道的一定会为你的人生画上完美的句号你要好好的等待好消息,No,Yes,No,"弟弟,你,终于,上,热搜,一定,有人,看到,一定,你,一个,公道,一定,为,你,人生,画,上,完美,句号,你,好好的,等待,好消息"
刘学州a,儿童收养/网暴/抑郁症/自杀,2022-01-24 00:02:00,2022-02-17 22:36:54,24.0,二苏-j,大家有没有发现，每次州州的这条微博转赞评到了456万时就开始变少，今天下午还明明快456万了，晚上来看就变成了394万，有谁知道是为什么吗？是不是要去问问微博后台？,Yes,No,No,"大家,有没有,发现,每次,州州,这条,微博,转赞,评,456万时,开始,变少,今天下午,明明,快,456万,晚上,来看,变成,394万,有谁知道,是为什么吗,是不是,问问,微博,后台"
刘学州a,儿童收养/网暴/抑郁症/自杀,2022-01-24 00:02:00,2022-02-17 14:24:17,24.0,二苏-j,州州，我隔几天就在人民日报下留言恳请关注你的事件希望得到重视,No,Yes,No,"州州,我,隔,几天,就在,人民日报,下,留言,恳请,关注,你,事件,希望,得到,重视"
刘学州a,儿童收养/网暴/抑郁症/自杀,2022-01-24 00:02:00,2022-02-05 14:36:42,12.0,萱崽mami,我会经常来看看你，看看那些施暴者有没有受到惩罚，我会记得你，即使帮不了什么忙，但我一定不会忘记你,No,Yes,No,"我,经常,看看,你,看看,那些,施暴者,有没有,受到,惩罚,我,记得,你,即使,帮,不了,什么,忙,我,一定,不会,忘记,你,"
刘学州a,儿童收养/网暴/抑郁症/自杀,2022-01-24 00:02:00,2022-03-04 23:04:23,39.0,贽o,州宝宝，或许热度会退，但是我们大家会记得你，有一个小天使曾经来过人间。晚安啦，州宝，明天睡醒了再来看你。睡前给你一个大大的拥抱,No,Yes,No,"州,宝宝,或许,热度,退,但是,我们大家,记得,你,一个,小,天使,曾经,来过,人间,晚安,州宝,明天,睡醒,再,来看,你,睡前,你,一个,大大,拥抱"
刘学州a,儿童收养/网暴/抑郁症/自杀,2022-01-24 00:02:00,2022-02-13 20:55:17,20.0,河南铁山靠,今天看到警方已掌握2000多条证据，真开心啊，马上恶人就要遭到报应了,Yes,No,No,"今天,看到,警方,掌握,2000多条,证据,真,开心,马上,恶人,就要,遭到,报应"
刘学州a,儿童收养/网暴/抑郁症/自杀,2022-01-24 00:02:00,2022-02-12 17:39:44,19.0,别惹我很护剧,弟弟刚刚你三亚的哥哥带我们去海边看你啦海风很大似乎在诉说着你的所有委屈，你听到了吗我们都想你,No,Yes,No,"弟弟,刚刚,你,三亚,哥哥,带,我们,海边,你,海风,很大,似乎,诉说,你,所有,委屈,你,听到,我们,想你,"
刘学州a,儿童收养/网暴/抑郁症/自杀,2022-01-24 00:02:00,2022-02-08 14:33:50,15.0,是Miss-S呀,宝贝.你看到了吗.周律师已经正式起诉网爆你的“蛆”了 .该受到惩罚的他们一个也跑不了.虽然阿姨不能为你做些什么.但是阿姨在他们受到惩罚的时候会用力为你鼓掌.老天不会放过他们.你在天上看好了.等到那一刻我们大家都会为你鼓掌.,No,Yes,No,"宝贝,.,你,看到,.,周律师,已经,正式,起诉,网爆,你,“,蛆,”,.,该,受到,惩罚,他们,一个,跑,不了,.,虽然,阿姨,不能,为,你,做些什么,.,但是,阿姨,他们,受到,惩罚,时候,用力,为,你,鼓掌,.,老天,不会,放过,他们,.,你,天上,看好,.,等到,那一刻,我们大家,都会,为,你,鼓掌,.,"
刘学州a,儿童收养/网暴/抑郁症/自杀,2022-01-24 00:02:00,2022-02-03 12:46:23,10.0,刘昱865,弟弟，谢谢你教会了姐姐好多的道理,No,Yes,No,"弟弟,谢谢,你,教会,姐姐,好多,道理"
刘学州a,儿童收养/网暴/抑郁症/自杀,2022-01-24 00:02:00,2022-01-30 11:58:15,6.0,如果爱p1,看刘学州12岁时帮人洗碗打工，是那么努力的孩子,No,Yes,No,",刘学州,12岁,时,帮,人,洗碗,打工,那么,努力,孩子,"
刘学州a,儿童收养/网暴/抑郁症/自杀,2022-01-24 00:02:00,2022-01-29 05:39:32,5.0,栋坊藏阁,反复遗弃诬陷他的亲生父母，霸凌PUA他的同学，猥亵他的男老师，劝退他不让考高中的校方领导，不作为的当地政府，渎职的教育局，水军造谣网暴者，没一个是干净的。都该逐一彻查追责起诉抓捕关押。,Yes,Yes,No,"反复,遗弃,诬陷,他,亲生,父母,霸凌,PUA,他,同学,猥亵,他,男,老师,劝退,他,不让,考,高中,校方,领导,不作为,当地,政府,渎职,教育局,水军,造谣,网暴,者,一个,干净,该,逐一,彻查,追责,起诉,抓捕,关押"
